id,art,artist,comb
0,"Teri bewafaai ke Angaaron mein lipti rahi yun ruh meri. Mein is tarah aag na hota, jo ho jaati tu meri.",Zakir Khan,"Teri bewafaai ke Angaaron mein lipti rahi yun ruh meri. Mein is tarah aag na hota, jo ho jaati tu meri. - Zakir Khan"
1,Ab koi haq se hath pakadkar mehfil mein dobara nahi baithaata. Sitaaron ke beech se suraj banne ke kuch apne hi nuksaan hua karte hai.,Zakir Khan,Ab koi haq se hath pakadkar mehfil mein dobara nahi baithaata. Sitaaron ke beech se suraj banne ke kuch apne hi nuksaan hua karte hai. - Zakir Khan
2,Ishq ko maasoom rehne do notebook ke aakhri panne par. Aap use kitaabon mein daalkar mushkil na kijiye.,Zakir Khan,Ishq ko maasoom rehne do notebook ke aakhri panne par. Aap use kitaabon mein daalkar mushkil na kijiye. - Zakir Khan
3,"Har ek dastoor se bewafai, main shiddat se hai nibhai. Raaste bhi khud hai dhundhe, aur manzil bhi khud banayi.",Zakir Khan,"Har ek dastoor se bewafai, main shiddat se hai nibhai. Raaste bhi khud hai dhundhe, aur manzil bhi khud banayi. - Zakir Khan"
4,"Hum dono me bas itna sa farq hai uske sab “lekin” mere naam se shuru hote hain, aur mere saare “kaash” uss par aa kar rukte hain.",Zakir Khan,"Hum dono me bas itna sa farq hai uske sab “lekin” mere naam se shuru hote hain, aur mere saare “kaash” uss par aa kar rukte hain. - Zakir Khan"
5,"Mein chah kar bhi, tum jaisa nahi ban paya. Dekho na…Tum toh aage badh gaye, par mein kahaan badh paaya.",Zakir Khan,"Mein chah kar bhi, tum jaisa nahi ban paya. Dekho na…Tum toh aage badh gaye, par mein kahaan badh paaya. - Zakir Khan"
6,"Zindagi se kuch zyaada nahi, bas itni si farmaaish hai. Ab tasveer se nahi tafseel se milne ki khwaaish hai.",Zakir Khan,"Zindagi se kuch zyaada nahi, bas itni si farmaaish hai. Ab tasveer se nahi tafseel se milne ki khwaaish hai. - Zakir Khan"
7,"Main Waqt aur tum Qayamat. Dekhna, jab hum milenge toh iss Kainaat mein sab kuch Ruk jayega",Zakir Khan,"Main Waqt aur tum Qayamat. Dekhna, jab hum milenge toh iss Kainaat mein sab kuch Ruk jayega - Zakir Khan"
8,"Ek arsey se hoon thamey, Kashti ko bhanwar mein. Toofaan se bhi jayada Sahil se siharta hoon",Zakir Khan,"Ek arsey se hoon thamey, Kashti ko bhanwar mein. Toofaan se bhi jayada Sahil se siharta hoon - Zakir Khan"
9,"Bewajah bewafaaon ko yaad kiya hai, Galat logon pe bahut Waqt barbaad kiya hai",Zakir Khan,"Bewajah bewafaaon ko yaad kiya hai, Galat logon pe bahut Waqt barbaad kiya hai - Zakir Khan"
10,"Ab woh aag nahi rahi, na Sholon jaisa dehekta hoon. Rang bhi sab ke jaisa hai, sabsa hi to Mehekta hoon. Ek arse se hoon thhame Kashti ko Bhavar mein, Toofaan se bhi jyada Saahil se Siharta hoon.",Zakir Khan,"Ab woh aag nahi rahi, na Sholon jaisa dehekta hoon. Rang bhi sab ke jaisa hai, sabsa hi to Mehekta hoon. Ek arse se hoon thhame Kashti ko Bhavar mein, Toofaan se bhi jyada Saahil se Siharta hoon. - Zakir Khan"
11,"Woh titli ki tarah aayi aur Zindagi ko baag kar gayi, Mere jitne napak the iraade unhe bhi paak kar gayi.",Zakir Khan,"Woh titli ki tarah aayi aur Zindagi ko baag kar gayi, Mere jitne napak the iraade unhe bhi paak kar gayi. - Zakir Khan"
12,"Apne aap ke bhi peeche Khada hoon mein, Zindagi kitna dheere chala hoon mein.",Zakir Khan,"Apne aap ke bhi peeche Khada hoon mein, Zindagi kitna dheere chala hoon mein. - Zakir Khan"
13,"Har ek copy ek peeche kucch na kuch khaas likha hai, Bas iss tarah tere mere Ishq ka Itihass likha hai. Tu Duniya me chaahe jahan bhi rahe, Apni Diary mein maine tujhe paas likha hai..",Zakir Khan,"Har ek copy ek peeche kucch na kuch khaas likha hai, Bas iss tarah tere mere Ishq ka Itihass likha hai. Tu Duniya me chaahe jahan bhi rahe, Apni Diary mein maine tujhe paas likha hai.. - Zakir Khan"
14,"Kya apni chhoti Ungli se uska bhi Haath thaam liya karti ho tum, Kya waise hai jaise Mera thhama karti thi?",Zakir Khan,"Kya apni chhoti Ungli se uska bhi Haath thaam liya karti ho tum, Kya waise hai jaise Mera thhama karti thi? - Zakir Khan"
15,"Mere kuch sawaal hai jo sirf Qayamat ke roz puchunga tumse, Kyuki uske pehle tumhari aur meri baat ho sake is laayak nahi ho tum.",Zakir Khan,"Mere kuch sawaal hai jo sirf Qayamat ke roz puchunga tumse, Kyuki uske pehle tumhari aur meri baat ho sake is laayak nahi ho tum. - Zakir Khan"
16,"Meri zameen tumse gehri rahi hai. Waqt aane do, aasman bhi tumse uncha rahega.",Zakir Khan,"Meri zameen tumse gehri rahi hai. Waqt aane do, aasman bhi tumse uncha rahega. - Zakir Khan"
17,"Hazaron baar suney hue gaane ka lyrics agar achanak se acchha lagne lagjaaye, toh babu samajh jao ki emotional watt lagane hi wali hai.",Zakir Khan,"Hazaron baar suney hue gaane ka lyrics agar achanak se acchha lagne lagjaaye, toh babu samajh jao ki emotional watt lagane hi wali hai. - Zakir Khan"
18,"Kamyaabi tere liye humne khud ko kuch yun taiyyar kar liya, Maine hr jazbaat baazar mein rakh kr ishtehaar kar liya",Zakir Khan,"Kamyaabi tere liye humne khud ko kuch yun taiyyar kar liya, Maine hr jazbaat baazar mein rakh kr ishtehaar kar liya - Zakir Khan"
19,"Bus ka intazar karte hue, metro mein khade khade, Chalte rikshaw mein baithe hue, Gehre shunya mein kya dekhte rehte ho? Gum chehra liye yeh kya sochte rehte ho? Kya khoya kya paaya ka, Hisab nahi laga paaye na iss baar bhi. Ghar nahi ja paaye na iss baar bhi.",Zakir Khan,"Bus ka intazar karte hue, metro mein khade khade, Chalte rikshaw mein baithe hue, Gehre shunya mein kya dekhte rehte ho? Gum chehra liye yeh kya sochte rehte ho? Kya khoya kya paaya ka, Hisab nahi laga paaye na iss baar bhi. Ghar nahi ja paaye na iss baar bhi. - Zakir Khan"
20,Apni nazron mein apni self-esteem low bahut galat baat hai.,Zakir Khan,Apni nazron mein apni self-esteem low bahut galat baat hai. - Zakir Khan
21,"Ego unme hai, Toh hum Halke hai kya…",Zakir Khan,"Ego unme hai, Toh hum Halke hai kya… - Zakir Khan"
22,Muskan ki Chamkan kahi or….,Zakir Khan,Muskan ki Chamkan kahi or…. - Zakir Khan
23,Badal important hai babu,Zakir Khan,Badal important hai babu - Zakir Khan
24,Bahot Pighala hu bhai… tabjake sakht huna hunnn.,Zakir Khan,Bahot Pighala hu bhai… tabjake sakht huna hunnn. - Zakir Khan
25,Hmm… Acha… Theek Hai,Zakir Khan,Hmm… Acha… Theek Hai - Zakir Khan
26,Bahat achhe se pata he ki Konsa dost he konsa dost nehi he Kyu ki yesha he ki Hum bhi kisika dost he,Zakir Khan,Bahat achhe se pata he ki Konsa dost he konsa dost nehi he Kyu ki yesha he ki Hum bhi kisika dost he - Zakir Khan
27,Jhuthe Hain wo log Wo Jo bolate Hain ki aadami roo Nahin Sakta – puchne wala chahiye re,Zakir Khan,Jhuthe Hain wo log Wo Jo bolate Hain ki aadami roo Nahin Sakta – puchne wala chahiye re - Zakir Khan
28,"Tum bhi yehin ho, hum bhi yehin hai",Zakir Khan,"Tum bhi yehin ho, hum bhi yehin hai - Zakir Khan"
29,"Mummy Papa na, alag hi nazar se dekhte hai tumhe. Papa log tumko teen saal aage dekhte hai – ‘Ye Kar raha hai mazze’. Aur Mummy tumhe das saal peechhe dekh rahi hoti hai – ‘Nahaya nai na tu aaj bhi’",Zakir Khan,"Mummy Papa na, alag hi nazar se dekhte hai tumhe. Papa log tumko teen saal aage dekhte hai – ‘Ye Kar raha hai mazze’. Aur Mummy tumhe das saal peechhe dekh rahi hoti hai – ‘Nahaya nai na tu aaj bhi’ - Zakir Khan"
30,"Ishq Kiya tha haq se kiya tha, Single bhi rahenge toh haq se rahenge",Zakir Khan,"Ishq Kiya tha haq se kiya tha, Single bhi rahenge toh haq se rahenge - Zakir Khan"
31,Laa idhar likhlu kahi ye UPSC ke exam me na aah jaye,Zakir Khan,Laa idhar likhlu kahi ye UPSC ke exam me na aah jaye - Zakir Khan
32,"Buddy, Aapke Papa Aaye Hai",Anubhav Singh Bassi,"Buddy, Aapke Papa Aaye Hai - Anubhav Singh Bassi"
33,Karwali Bezzati?,Abhishek Upmanyu,Karwali Bezzati? - Abhishek Upmanyu
34,Life Mein Chahiye Izzat,Zakir Khan,Life Mein Chahiye Izzat - Zakir Khan
35,"Excuse me, brother",Aakash Gupta,"Excuse me, brother - Aakash Gupta"
36,Ye jaise pata hi nehi tha humein,Anubhav Singh Bassi,Ye jaise pata hi nehi tha humein - Anubhav Singh Bassi
37,"Cheating ka source ek hoga, pass sarein ho jayenge",Anubhav Singh Bassi,"Cheating ka source ek hoga, pass sarein ho jayenge - Anubhav Singh Bassi"
38,"If true, why? Because its not false",Anubhav Singh Bassi,"If true, why? Because its not false - Anubhav Singh Bassi"
39,Itna kanoon mai bhi janta hoon,Anubhav Singh Bassi,Itna kanoon mai bhi janta hoon - Anubhav Singh Bassi
40,Jaanta hai toh likhde,Anubhav Singh Bassi,Jaanta hai toh likhde - Anubhav Singh Bassi
41,"4 true hain, 6 false",Anubhav Singh Bassi,"4 true hain, 6 false - Anubhav Singh Bassi"
42,lo karlo cheating,Anubhav Singh Bassi,lo karlo cheating - Anubhav Singh Bassi
43,"Execution nehi tha na humare pas, planning thi!",Anubhav Singh Bassi,"Execution nehi tha na humare pas, planning thi! - Anubhav Singh Bassi"
44,"Shampoo, Aakash bhaiya ayein hain, apke broother! Hello bolo bhaiya ko!",Aakash Gupta,"Shampoo, Aakash bhaiya ayein hain, apke broother! Hello bolo bhaiya ko! - Aakash Gupta"
45,"Shampoo jao, Aakash bhaiya ko ghuma lao",Aakash Gupta,"Shampoo jao, Aakash bhaiya ko ghuma lao - Aakash Gupta"
46,"Toh kya hua, kata hi toh hai!",Aakash Gupta,"Toh kya hua, kata hi toh hai! - Aakash Gupta"
47,Mai Ice Paan ki baat kar rha tha,Aakash Gupta,Mai Ice Paan ki baat kar rha tha - Aakash Gupta
48,I am strong,Anubhav Singh Bassi,I am strong - Anubhav Singh Bassi
49,Koi sense hai iss baat ki? Humein lag rhi thi us time,Anubhav Singh Bassi,Koi sense hai iss baat ki? Humein lag rhi thi us time - Anubhav Singh Bassi
50,"Toh maine kaha, KAISE???",Anubhav Singh Bassi,"Toh maine kaha, KAISE??? - Anubhav Singh Bassi"
51,Ab to ni mann kar rha,Anubhav Singh Bassi,Ab to ni mann kar rha - Anubhav Singh Bassi
52,Aur yeh sansaar tamasha dekhega,Anubhav Singh Bassi,Aur yeh sansaar tamasha dekhega - Anubhav Singh Bassi
53,Itna naam bhi nai karna tha,Anubhav Singh Bassi,Itna naam bhi nai karna tha - Anubhav Singh Bassi
54,Ye toh mazdooro wale kam karwa rahe hai,Anubhav Singh Bassi,Ye toh mazdooro wale kam karwa rahe hai - Anubhav Singh Bassi
55,"Aap jo bol rahe ho, woh apke kan tak ja rha hai?",Anubhav Singh Bassi,"Aap jo bol rahe ho, woh apke kan tak ja rha hai? - Anubhav Singh Bassi"
56,"Kehti, kya hai ye?",Anubhav Singh Bassi,"Kehti, kya hai ye? - Anubhav Singh Bassi"
57,Hum kuch galat kar rahe hain. Kya hi galat kar rahe hain? Kya hi hota hai galat?,Anubhav Singh Bassi,Hum kuch galat kar rahe hain. Kya hi galat kar rahe hain? Kya hi hota hai galat? - Anubhav Singh Bassi
58,Inko kya hi pata chalega?,Abhishek Upmanyu,Inko kya hi pata chalega? - Abhishek Upmanyu
59,Iska answer to ata hi nehi mujhe,Abhishek Upmanyu,Iska answer to ata hi nehi mujhe - Abhishek Upmanyu
60,Upar wala toh saath nehi de rha aj,Anubhav Singh Bassi,Upar wala toh saath nehi de rha aj - Anubhav Singh Bassi
61,Mere andar ka ACP Pradyumn jaag gaya,Zakir Khan,Mere andar ka ACP Pradyumn jaag gaya - Zakir Khan
62,Paagal hai kya?,Zakir Khan,Paagal hai kya? - Zakir Khan
63,Humse zyada mehnat nehi hoti,Zakir Khan,Humse zyada mehnat nehi hoti - Zakir Khan
64,Ye bijli se chalta hai?,Anubhav Singh Bassi,Ye bijli se chalta hai? - Anubhav Singh Bassi
65,Yeh koi baat hai karne ki?,Anubhav Singh Bassi,Yeh koi baat hai karne ki? - Anubhav Singh Bassi
66,Oho! Bahut hi rare moment of my life!,Zakir Khan,Oho! Bahut hi rare moment of my life! - Zakir Khan
67,Ye ek janam ke hain?,Anubhav Singh Bassi,Ye ek janam ke hain? - Anubhav Singh Bassi
